{
  "id": "FC-0016",
  "version": 1,
  "vehicle": {
    "year": 2015,
    "make": "Chevy",
    "model": "Silverado",
    "powertrain": "gas",
    "mileage": 122000
  },
  "complaint": "Brake pedal suddenly got very hard to push and the truck takes much longer to stop; lots of effort needed.",
  "observations": [
    "Pedal is firm/high but braking is weak",
    "Hissing sound near the firewall when pressing the pedal",
    "Engine runs fine otherwise"
  ],
  "dtc_codes": [],
  "ground_truth": {
    "primary_diagnosis": "brake_booster",
    "acceptable_diagnoses": [
      "brake_booster",
      "vacuum_leak"
    ],
    "wrong_but_plausible": [
      "brake_master_cylinder",
      "brake_pads_front"
    ],
    "must_mention_safety": false,
    "expected_cost_range_usd": [
      250,
      600
    ],
    "severity": "urgent"
  },
  "tags": [
    "brakes",
    "safety_critical",
    "urgent"
  ]
}
